{
  "run_id": "DEMO-RUN-001",
  "supplier_request_id": "42",
  "checkpoint_type": "VENDOR_OVERVIEW_MENU_PATH",
  "screenshot_path": "screenshots/archive/DEMO-RUN-001/step-007-vendor-overview-menu-path.png",
  "expected_screen": "GnuCash Business > Vendor submenu with Vendors Overview visible",
  "expected_field": "Vendor submenu",
  "expected_value": "Vendors Overview",
  "supplier_context": {
    "supplier_legal_name": "Blue Kite Consulting Ltd"
  }
}
